{
  "openship": "1.0",
  "capability": "sources",
  "generatedAt": "2026-08-21T12:00:00.000Z",
  "digest": "sha256:1d322539e651a3c2d7c51eb8b33160627395b9601bff909e599771b806d9e565",
  "project": {
    "name": "Example",
    "productDescription": "An example OpenShip project.",
    "productSummary": "# Product\n\nAn example OpenShip project.",
    "technicalDescription": "A source snapshot published through OpenShip.",
    "technicalSummary": "# Implementation\n\nRetrieve the source bundle, install its dependencies, and follow its deployment documentation."
  },
  "totals": {
    "files": 2,
    "bytes": 53
  },
  "files": [
    {
      "path": "app/page.js",
      "size": 34,
      "sha256": "6ce070542590adb63fd9621ff65be91446f8bd9b65465cda5e4ec43e5d86dc5e",
      "encoding": "utf-8",
      "mediaType": "text/plain; charset=utf-8",
      "type": "file"
    },
    {
      "path": "package.json",
      "size": 19,
      "sha256": "9579cf52285b23b618b615d704b19d04ff591ae513f6ae34ef37e2b9a067cb12",
      "encoding": "utf-8",
      "mediaType": "application/json; charset=utf-8",
      "type": "file"
    }
  ]
}
